{
  "catalog": {
    "id": "website-qa-pilot",
    "status": "pilot",
    "version": "1.0.0-pilot.7"
  },
  "generatedAt": "2026-08-24T12:30:00.000Z",
  "items": [
    {
      "criteria": [
        {
          "id": "CORE-DOM-02/C1",
          "mode": "automatic",
          "outcome": "noEvidence",
          "statement": "Die geprüfte HTTP-Variante verwendet eine permanente Weiterleitung auf HTTPS.",
          "recordRefs": [],
          "requiredAssertionIds": [
            "http.redirect.permanent"
          ]
        },
        {
          "id": "CORE-DOM-02/C2",
          "mode": "automatic",
          "outcome": "noEvidence",
          "statement": "Pfad und Query bleiben bei der geprüften HTTP-zu-HTTPS-Weiterleitung erhalten.",
          "recordRefs": [],
          "requiredAssertionIds": [
            "http.redirect.path-query-preserved"
          ]
        }
      ],
      "evidenceOutcome": "open",
      "id": "CORE-DOM-02",
      "module": "core",
      "projectStatus": "open",
      "statement": "HTTP leitet dauerhaft, pfad- und queryerhaltend und möglichst ohne unnötige Zwischenstation auf HTTPS um."
    },
    {
      "criteria": [
        {
          "evidenceClass": "infrastructure-access",
          "evidenceInstructions": "Nachweis eines geeigneten TLS-Werkzeugs mit Datum, Hosts und Ergebnis referenzieren.",
          "id": "CORE-DOM-04/C1",
          "mode": "external",
          "outcome": "noEvidence",
          "statement": "Zertifikat, Zertifikatskette, Hostabdeckung und TLS-Versionen wurden für die vorgesehenen Hosts geprüft.",
          "recordRefs": []
        },
        {
          "evidenceClass": "administrative",
          "evidenceInstructions": "Plattformkonfiguration oder Erneuerungsnachweis ohne Zugangsdaten dokumentieren.",
          "id": "CORE-DOM-04/C2",
          "mode": "manual",
          "outcome": "noEvidence",
          "statement": "Die automatische Zertifikatserneuerung ist durch Infrastrukturkonfiguration oder einen erfolgreichen Erneuerungsvorgang plausibilisiert.",
          "recordRefs": []
        }
      ],
      "evidenceOutcome": "open",
      "id": "CORE-DOM-04",
      "module": "core",
      "projectStatus": "external",
      "statement": "Zertifikat, Zertifikatskette, Hostabdeckung und unterstützte TLS-Versionen sind mit einem geeigneten Werkzeug geprüft. Die automatische Verlängerung ist durch Konfiguration oder einen erfolgreichen Erneuerungsnachweis plausibilisiert.",
      "workflow": {
        "itemId": "CORE-DOM-04",
        "status": "external",
        "recordedAt": "2026-08-24",
        "recordedBy": "technisch verantwortliche Stelle",
        "note": "Der Nachweis zur automatischen Zertifikatserneuerung liegt beim Hostinganbieter.",
        "responsible": "Hostinganbieter"
      }
    },
    {
      "criteria": [
        {
          "id": "CORE-DOM-05/C1",
          "mode": "automatic",
          "outcome": "pass",
          "statement": "Alle vom Crawl geprüften indexierbaren Seiten besitzen genau einen absoluten Canonical.",
          "recordRefs": [
            "R000001"
          ],
          "requiredAssertionIds": [
            "crawl.canonical.single-absolute"
          ]
        },
        {
          "id": "CORE-DOM-05/C2",
          "mode": "automatic",
          "outcome": "pass",
          "statement": "Die geprüften Canonicals entsprechen der jeweiligen finalen Seiten-URL.",
          "recordRefs": [
            "R000002"
          ],
          "requiredAssertionIds": [
            "crawl.canonical.matches-final-url"
          ]
        },
        {
          "evidenceClass": "project-review",
          "evidenceInstructions": "Crawlziel und finale URL-Stichprobe mit der dokumentierten öffentlichen URL-Strategie des Projekts abgleichen.",
          "id": "CORE-DOM-05/C3",
          "mode": "manual",
          "outcome": "noEvidence",
          "statement": "Die finalen Seiten-URLs entsprechen der projektspezifisch festgelegten öffentlichen Host-, HTTPS- und Pfadstrategie.",
          "recordRefs": []
        }
      ],
      "evidenceOutcome": "partial",
      "id": "CORE-DOM-05",
      "module": "core",
      "projectStatus": "partial",
      "statement": "Jede indexierbare Seite enthält genau einen absoluten Canonical auf der festgelegten Host- und HTTPS-Variante."
    },
    {
      "criteria": [
        {
          "id": "CORE-DOM-07/C1",
          "mode": "automatic",
          "outcome": "noEvidence",
          "statement": "Die geprüfte HTTPS-Navigation enthält keinen Downgrade auf HTTP.",
          "recordRefs": [],
          "requiredAssertionIds": [
            "https.redirect.no-downgrade"
          ]
        },
        {
          "id": "CORE-DOM-07/C2",
          "mode": "automatic",
          "outcome": "noEvidence",
          "statement": "Die geprüfte Zielnavigation enthält keine unnötige Weiterleitungskette.",
          "recordRefs": [],
          "requiredAssertionIds": [
            "https.redirect.chain-direct"
          ]
        },
        {
          "id": "CORE-DOM-07/C3",
          "mode": "automatic",
          "outcome": "noEvidence",
          "statement": "Die geprüfte HTTP-zu-HTTPS-Navigation enthält keine unnötige Weiterleitungskette.",
          "recordRefs": [],
          "requiredAssertionIds": [
            "http.redirect.chain-direct"
          ]
        },
        {
          "evidenceClass": "project-review",
          "evidenceInstructions": "Geprüfte Hosts und projektspezifische Redirectrouten mit Ergebnis dokumentieren.",
          "id": "CORE-DOM-07/C4",
          "mode": "manual",
          "outcome": "noEvidence",
          "statement": "Alle veröffentlichten Host- und Routenvarianten, die zum Projektumfang gehören, wurden inventarisiert und geprüft.",
          "recordRefs": []
        }
      ],
      "evidenceOutcome": "open",
      "id": "CORE-DOM-07",
      "module": "core",
      "projectStatus": "open",
      "statement": "Weiterleitungen wurden auf Statuscode, Pfad- und Queryerhalt, Schleifen und unnötige Ketten geprüft."
    },
    {
      "criteria": [
        {
          "id": "CORE-DOM-08/C1",
          "mode": "automatic",
          "outcome": "pass",
          "statement": "HSTS ist auf allen vom HTTP-Prüfer untersuchten HTTPS-Antwortklassen vorhanden.",
          "recordRefs": [
            "R000003",
            "R000004"
          ],
          "requiredAssertionIds": [
            "http.security.selected-response-coverage-complete",
            "http.hsts.present"
          ]
        },
        {
          "id": "CORE-DOM-08/C2",
          "mode": "automatic",
          "outcome": "pass",
          "statement": "Der HSTS-max-age ist syntaktisch gültig und beträgt mindestens 180 Tage.",
          "recordRefs": [
            "R000003",
            "R000005"
          ],
          "requiredAssertionIds": [
            "http.security.selected-response-coverage-complete",
            "http.hsts.max-age-adequate"
          ]
        },
        {
          "evidenceClass": "infrastructure-access",
          "evidenceInstructions": "Antwortklassen, Hosts und nicht erreichbare Infrastrukturgrenzen dokumentieren.",
          "id": "CORE-DOM-08/C3",
          "mode": "manual",
          "outcome": "noEvidence",
          "statement": "Relevante HTTPS-Antwortklassen und vorgeschaltete Weiterleitungshosts wurden projektspezifisch bestimmt.",
          "recordRefs": []
        },
        {
          "evidenceClass": "administrative",
          "evidenceInstructions": "Entscheidung, Subdomaininventar und verantwortliche Stelle dokumentieren.",
          "id": "CORE-DOM-08/C4",
          "mode": "manual",
          "outcome": "noEvidence",
          "statement": "includeSubDomains und preload wurden anhand aller betroffenen Subdomains bewusst entschieden.",
          "recordRefs": []
        }
      ],
      "evidenceOutcome": "partial",
      "id": "CORE-DOM-08",
      "module": "core",
      "projectStatus": "partial",
      "statement": "HSTS-Wert und Reichweite sind bewusst gewählt und auf allen relevanten HTTPS-Antworten einschließlich vorgeschalteter Weiterleitungshosts geprüft. `includeSubDomains` und `preload` werden nur nach Prüfung aller betroffenen Subdomains aktiviert."
    },
    {
      "criteria": [
        {
          "id": "CORE-ERR-01/C1",
          "mode": "automatic",
          "outcome": "noEvidence",
          "statement": "Der geprüfte unbekannte Pfad antwortet mit HTTP 404.",
          "recordRefs": [],
          "requiredAssertionIds": [
            "error.not-found.status-404"
          ]
        },
        {
          "id": "CORE-ERR-01/C2",
          "mode": "automatic",
          "outcome": "noEvidence",
          "statement": "Die automatische Stichprobe erkennt keine typischen Stacktraces oder internen Dateipfade.",
          "recordRefs": [],
          "requiredAssertionIds": [
            "error.not-found.no-technical-details"
          ]
        },
        {
          "evidenceClass": "editorial",
          "evidenceInstructions": "Fehlerseite visuell und redaktionell prüfen; automatische Mustererkennung genügt nicht.",
          "id": "CORE-ERR-01/C3",
          "mode": "manual",
          "outcome": "noEvidence",
          "statement": "Die Fehlerseite ist für die vorgesehenen Nutzer verständlich und enthält keine projektspezifisch sensiblen Details.",
          "recordRefs": []
        }
      ],
      "evidenceOutcome": "open",
      "id": "CORE-ERR-01",
      "module": "core",
      "projectStatus": "open",
      "statement": "Eine unbekannte Browserroute liefert eine verständliche HTML-Fehlerseite mit tatsächlichem HTTP-404-Status und ohne interne technische Details."
    },
    {
      "criteria": [
        {
          "id": "CORE-ERR-02/C1",
          "mode": "automatic",
          "outcome": "pass",
          "statement": "Die geprüfte 404-Antwort enthält eine noindex-Anweisung.",
          "recordRefs": [
            "R000006"
          ],